description,description_link,country,project_title,notice_type,language,publish_date,project_link
"Selection of an Implementing Agency (IA) for“ Design, Development, and Implementation of Integrated Process Management System” for Water Resources Department, Government Of Assam",http://projects.worldbank.org/en/projects-operations/procurement-detail/OP00333425,India,Assam Integrated River Basin Management Program - P174593,Request for Expression of Interest,English,"February 23, 2025",http://projects.worldbank.org/en/projects-operations/project-detail/P174593
"Construction of Garowe Storm Water Drainage Package 3 (Lot 2 - Part 1) Garowe Municipality, Puntaland, Somalia",http://projects.worldbank.org/en/projects-operations/procurement-detail/OP00337019,Somalia,Somalia Urban Resilience Project II - P170922,Invitation for Bids,English,"February 23, 2025",http://projects.worldbank.org/en/projects-operations/project-detail/P170922
Procurement of Short Term Individual consultant- Programme manager for National Performance based programme,http://projects.worldbank.org/en/projects-operations/procurement-detail/OP00339453,Kenya,Water and Sanitation Development Project - P156634,Contract Award,English,"February 23, 2025",http://projects.worldbank.org/en/projects-operations/project-detail/P156634
"Devices, supplies and equipment for Veterinary center in north",http://projects.worldbank.org/en/projects-operations/procurement-detail/OP00341358,Jordan,"Agriculture Resilience, Value Chain Development and Innovation (ARDI) Program - P167946",Contract Award,English,"February 23, 2025",http://projects.worldbank.org/en/projects-operations/project-detail/P167946
"Devices, supplies and equipment for Veterinary center in north",http://projects.worldbank.org/en/projects-operations/procurement-detail/OP00341359,Jordan,"Agriculture Resilience, Value Chain Development and Innovation (ARDI) Program - P167946",Contract Award,English,"February 23, 2025",http://projects.worldbank.org/en/projects-operations/project-detail/P167946
"Devices, supplies and equipment for Veterinary center in north",http://projects.worldbank.org/en/projects-operations/procurement-detail/OP00341360,Jordan,"Agriculture Resilience, Value Chain Development and Innovation (ARDI) Program - P167946",Contract Award,English,"February 23, 2025",http://projects.worldbank.org/en/projects-operations/project-detail/P167946
CONSULTANCY FOR DESIGN REVIEW AND SUPERVISION FOR REHABILITATION OF BONA DYKE IN PHALOMBE DISTRICT AND MKOMBEZI DYKE IN CHIKWAWA DISTRICT,http://projects.worldbank.org/en/projects-operations/procurement-detail/OP00341365,Eastern and Southern Africa,Regional Climate Resilience Program for Eastern and Southern Africa 2 Project (RCRP2) - P181308,Request for Expression of Interest,English,"February 23, 2025",http://projects.worldbank.org/en/projects-operations/project-detail/P181308
Hiring of international implementation partners for HAI program in Sindh,http://projects.worldbank.org/en/projects-operations/procurement-detail/OP00341366,Pakistan,Sindh Water and Agriculture Transformation Project (SWAT) - P167596,Contract Award,English,"February 23, 2025",http://projects.worldbank.org/en/projects-operations/project-detail/P167596
"Procurement of 500,000 polyethylene Bags for the Production of fruit trees for Subprojects",http://projects.worldbank.org/en/projects-operations/procurement-detail/OP00341367,Eastern and Southern Africa,Agricultural Productivity Program for Southern Africa - Angola & Lesotho - P164486,Contract Award,English,"February 23, 2025",http://projects.worldbank.org/en/projects-operations/project-detail/P164486
"Devices, supplies and equipment for Veterinary center in north",http://projects.worldbank.org/en/projects-operations/procurement-detail/OP00341368,Jordan,"Agriculture Resilience, Value Chain Development and Innovation (ARDI) Program - P167946",Contract Award,English,"February 23, 2025",http://projects.worldbank.org/en/projects-operations/project-detail/P167946
Database Building and Networking Engineer,http://projects.worldbank.org/en/projects-operations/procurement-detail/OP00341369,"Egypt, Arab Republic of",Takaful and Karama Cash Transfer Expansion and Systems Building Project - P179665,Contract Award,English,"February 23, 2025",http://projects.worldbank.org/en/projects-operations/project-detail/P179665
Especialista em Salvaguardas Socias,http://projects.worldbank.org/en/projects-operations/procurement-detail/OP00341370,Angola,Angola Digital Acceleration Project - P180693,Contract Award,Portuguese,"February 23, 2025",http://projects.worldbank.org/en/projects-operations/project-detail/P180693
Development of the National Export Promotion Strategy,http://projects.worldbank.org/en/projects-operations/procurement-detail/OP00341377,Eastern and Southern Africa,"De-risking, inclusion and value enhancement of pastoral economies in the Horn of Africa - P176517",Contract Award,English,"February 23, 2025",http://projects.worldbank.org/en/projects-operations/project-detail/P176517
Procurement of Day old chickens for Poultry Production or GBEs at arbegona woreda Yaye 01 kebele,http://projects.worldbank.org/en/projects-operations/procurement-detail/OP00341378,Eastern and Southern Africa,Food Systems Resilience Program for Eastern and Southern Africa - P178566,Contract Award,English,"February 23, 2025",http://projects.worldbank.org/en/projects-operations/project-detail/P178566
"HIRING OF MANAGER ADMIN & ACCOUNTS, (NATIONAL INDIVIDUAL CONSULTANT) FOR PCMU.",http://projects.worldbank.org/en/projects-operations/procurement-detail/OP00341379,Pakistan,Sindh Water and Agriculture Transformation Project (SWAT) - P167596,Request for Expression of Interest,English,"February 23, 2025",http://projects.worldbank.org/en/projects-operations/project-detail/P167596
"PROCUREMENT OF CONSULTANCY SERVICES (INDIVIDUAL CONSULTANTS) MONITORING & EVALUATION SPECIALIST, (NATIONAL) FOR PCMU SWAT.",http://projects.worldbank.org/en/projects-operations/procurement-detail/OP00341380,Pakistan,Sindh Water and Agriculture Transformation Project (SWAT) - P167596,Request for Expression of Interest,English,"February 23, 2025",http://projects.worldbank.org/en/projects-operations/project-detail/P167596
Development of Agriculture Strategic Plan,http://projects.worldbank.org/en/projects-operations/procurement-detail/OP00341387,Somalia,Barwaaqo - Somalia Water for Rural Resilience Project - P177627,Contract Award,English,"February 23, 2025",http://projects.worldbank.org/en/projects-operations/project-detail/P177627
"Recrutement d'un consultant pour l'Etude circuits d'approvisionnement, les zones de prédilection de chaque produit et la recherche de fournitures directs",http://projects.worldbank.org/en/projects-operations/procurement-detail/OP00341388,Djibouti,Djibouti Emergency Food Security Crisis Response Project - P178988,Contract Award,French,"February 23, 2025",http://projects.worldbank.org/en/projects-operations/project-detail/P178988
"Supply, installation, testing and commissioning of equipment on board Longitudinal Ferry Vessels and Cross Ferry Vessels",http://projects.worldbank.org/en/projects-operations/procurement-detail/OP00341389,India,"West Bengal Inland Water Transport, Logistics and Spatial Development Project - P166020",Invitation for Bids,English,"February 23, 2025",http://projects.worldbank.org/en/projects-operations/project-detail/P166020
"Devices, supplies and equipment for Veterinary center in north",http://projects.worldbank.org/en/projects-operations/procurement-detail/OP00341390,Jordan,"Agriculture Resilience, Value Chain Development and Innovation (ARDI) Program - P167946",Contract Award,English,"February 23, 2025",http://projects.worldbank.org/en/projects-operations/project-detail/P167946
Association locale Recrutement d une association locale chargee de l encadrement et l accompagnement des menages des districts de Ignie et kintele et de Pointe Noire porteurs de micro projets et des jeunes candidats a la formation professionnelle (lot 3),http://projects.worldbank.org/en/projects-operations/procurement-detail/OP00341391,"Congo, Republic of",CG Rep. LISUNGI Safety Nets System Project - P145263,Contract Award,French,"February 23, 2025",http://projects.worldbank.org/en/projects-operations/project-detail/P145263
External Audit,http://projects.worldbank.org/en/projects-operations/procurement-detail/OP00341392,Jordan,Jordan Water Sector Efficiency Project - P176619,Request for Expression of Interest,English,"February 23, 2025",http://projects.worldbank.org/en/projects-operations/project-detail/P176619
Senior Administrative Officer to report to the executive director of the Rural and Environmental Industries Support Fund,http://projects.worldbank.org/en/projects-operations/procurement-detail/OP00341393,"Egypt, Arab Republic of",Takaful and Karama Cash Transfer Expansion and Systems Building Project - P179665,Contract Award,English,"February 23, 2025",http://projects.worldbank.org/en/projects-operations/project-detail/P179665
Junior Program Fund Disbursement,http://projects.worldbank.org/en/projects-operations/procurement-detail/OP00341394,Indonesia,Indonesian Environment Fund Technical Assistance Project - P175025,Contract Award,English,"February 23, 2025",http://projects.worldbank.org/en/projects-operations/project-detail/P175025
Acquisition de kit de couchage au profit de la DPEPPNF du Zondoma dans le cadre du Projet d’Amélioration de l’Accès et de la Qualité de l’Education (PAAQE) (Fonds de contingence).,http://projects.worldbank.org/en/projects-operations/procurement-detail/OP00341395,Burkina Faso,B. Faso - Education Access and Quality Improvement Project (EAQIP) - P148062,Contract Award,French,"February 23, 2025",http://projects.worldbank.org/en/projects-operations/project-detail/P148062
Acquisition et livraison de mobilier scolaire au profit de la DPEPS du Lorum dans le cadre du PAAQE (fonds de contingence).,http://projects.worldbank.org/en/projects-operations/procurement-detail/OP00341396,Burkina Faso,B. Faso - Education Access and Quality Improvement Project (EAQIP) - P148062,Contract Award,French,"February 23, 2025",http://projects.worldbank.org/en/projects-operations/project-detail/P148062
FMIS Specialist 2024,http://projects.worldbank.org/en/projects-operations/procurement-detail/OP00341397,Marshall Islands,Project to Strengthen budget execution and financial reporting systems - P163131,Contract Award,English,"February 23, 2025",http://projects.worldbank.org/en/projects-operations/project-detail/P163131
"Líder Planeación, Seguimiento y Monitoreo",http://projects.worldbank.org/en/projects-operations/procurement-detail/OP00341398,Colombia,Multipurpose Cadaster Project - P162594,Contract Award,Spanish; Castilian,"February 23, 2025",http://projects.worldbank.org/en/projects-operations/project-detail/P162594
"Devices, supplies and equipment for Veterinary center in north",http://projects.worldbank.org/en/projects-operations/procurement-detail/OP00341401,Jordan,"Agriculture Resilience, Value Chain Development and Innovation (ARDI) Program - P167946",Contract Award,English,"February 23, 2025",http://projects.worldbank.org/en/projects-operations/project-detail/P167946
Construction of Dokmit small bridge at E/Denbia worda,http://projects.worldbank.org/en/projects-operations/procurement-detail/OP00341402,Eastern and Southern Africa,Food Systems Resilience Program for Eastern and Southern Africa - P178566,Contract Award,English,"February 23, 2025",http://projects.worldbank.org/en/projects-operations/project-detail/P178566
Administrative Assistant for assisting in the training programs of the health conditionality.,http://projects.worldbank.org/en/projects-operations/procurement-detail/OP00341403,"Egypt, Arab Republic of",Takaful and Karama Cash Transfer Expansion and Systems Building Project - P179665,Contract Award,English,"February 23, 2025",http://projects.worldbank.org/en/projects-operations/project-detail/P179665
Junior Program Fund Disbursement 2,http://projects.worldbank.org/en/projects-operations/procurement-detail/OP00341404,Indonesia,Indonesian Environment Fund Technical Assistance Project - P175025,Contract Award,English,"February 23, 2025",http://projects.worldbank.org/en/projects-operations/project-detail/P175025
"Acquisition et installation des équipements pour la mise en place de 6 salles réunion intelligentes, une par UCR",http://projects.worldbank.org/en/projects-operations/procurement-detail/OP00341405,Cameroon,Local Governance and Resilient Communities Project - P175846,Contract Award,French,"February 23, 2025",http://projects.worldbank.org/en/projects-operations/project-detail/P175846
"Acquisition et installation des équipements pour la mise en place de 6 salles réunion intelligentes, une par UCR",http://projects.worldbank.org/en/projects-operations/procurement-detail/OP00341406,Cameroon,Local Governance and Resilient Communities Project - P175846,Contract Award,French,"February 23, 2025",http://projects.worldbank.org/en/projects-operations/project-detail/P175846
"EPC for Distribution Network Upgrading, Strengthening and Rehabilitating to improve the reliability of supply in the towns under phase 1, Package 1 (2 contracts, 17 towns).",http://projects.worldbank.org/en/projects-operations/procurement-detail/OP00341407,Ethiopia,"Power Sector Reform, Investment and Modernization in Ethiopia (PRIME-1) - P176731",Invitation for Bids,English,"February 23, 2025",http://projects.worldbank.org/en/projects-operations/project-detail/P176731
Consultancy For the Supervision of the SCADA/EMS SYSTEM And The National Load Dispatch Center (NLDC) For The Liberia Electricity Corporation (LEC),http://projects.worldbank.org/en/projects-operations/procurement-detail/OP00341408,Liberia,Liberia Electricity Sector Strengthening and Access Project (LESSAP) - P173416,Contract Award,English,"February 23, 2025",http://projects.worldbank.org/en/projects-operations/project-detail/P173416
School facilities adaptation and refurbishment in city of Zagreb,http://projects.worldbank.org/en/projects-operations/procurement-detail/OP00341409,Croatia,"Croatia: Towards Sustainable, Equitable and Efficient Education Project - P170178",Contract Award,English,"February 23, 2025",http://projects.worldbank.org/en/projects-operations/project-detail/P170178
Acquisition de kits de dignité au profit de la DPEPPNF du Zondoma dans le cadre du Projet d’Amélioration de l’Accès et de la Qualité de l’Education (PAAQE) (Fonds de contingence).,http://projects.worldbank.org/en/projects-operations/procurement-detail/OP00341410,Burkina Faso,B. Faso - Education Access and Quality Improvement Project (EAQIP) - P148062,Contract Award,French,"February 23, 2025",http://projects.worldbank.org/en/projects-operations/project-detail/P148062
Recrutement d’un cabinet pour la réalisation de l'audit de SIC@2,http://projects.worldbank.org/en/projects-operations/procurement-detail/OP00341411,Benin,Benin Youth Inclusion Project - P170425,Request for Expression of Interest,French,"February 23, 2025",http://projects.worldbank.org/en/projects-operations/project-detail/P170425
Acquisition des autres matériels de bureau pour l'UGP.,http://projects.worldbank.org/en/projects-operations/procurement-detail/OP00341412,Cameroon,Local Governance and Resilient Communities Project - P175846,Contract Award,French,"February 23, 2025",http://projects.worldbank.org/en/projects-operations/project-detail/P175846
Travaux d'aménagement de deux salles de réunions intelligentes à l'Unité de Gestion du PROLOG.,http://projects.worldbank.org/en/projects-operations/procurement-detail/OP00341413,Cameroon,Local Governance and Resilient Communities Project - P175846,Contract Award,French,"February 23, 2025",http://projects.worldbank.org/en/projects-operations/project-detail/P175846
"Acquisition et installation des équipements pour la mise en place de 6 salles réunion intelligentes, une par UCR",http://projects.worldbank.org/en/projects-operations/procurement-detail/OP00341414,Cameroon,Local Governance and Resilient Communities Project - P175846,Contract Award,French,"February 23, 2025",http://projects.worldbank.org/en/projects-operations/project-detail/P175846
"Acquisition et installation des équipements pour la mise en place de 6 salles réunion intelligentes, une par UCR",http://projects.worldbank.org/en/projects-operations/procurement-detail/OP00341415,Cameroon,Local Governance and Resilient Communities Project - P175846,Contract Award,French,"February 23, 2025",http://projects.worldbank.org/en/projects-operations/project-detail/P175846
"Acquisition et installation des équipements pour la mise en place de 6 salles réunion intelligentes, une par UCR",http://projects.worldbank.org/en/projects-operations/procurement-detail/OP00341416,Cameroon,Local Governance and Resilient Communities Project - P175846,Contract Award,French,"February 23, 2025",http://projects.worldbank.org/en/projects-operations/project-detail/P175846
"Liderar la planificación, seguimiento y gestión ambiental de los proyectos que se adelanten en el marco de los préstamos del BID y el Banco Mundial, ejecutados por el Ministerio de Igualdad y Equidad como entidad ejecutora del FTSP",http://projects.worldbank.org/en/projects-operations/procurement-detail/OP00341417,Colombia,Enhancing Waterway Connectivity and Water Service Provision in Colombia’s Plan Pazcifico - P156880,Contract Award,Spanish; Castilian,"February 23, 2025",http://projects.worldbank.org/en/projects-operations/project-detail/P156880
Consultancy Services for Electrical Engineer ( Inspector) for the Liberia Electricity Regulatory Commission,http://projects.worldbank.org/en/projects-operations/procurement-detail/OP00341418,Liberia,Liberia Electricity Sector Strengthening and Access Project (LESSAP) - P173416,Contract Award,English,"February 23, 2025",http://projects.worldbank.org/en/projects-operations/project-detail/P173416
Recrutement d'un consultant individuel en vue d'assurer la formation d’agents en Prévision Numérique du Temps (PNT) et assimilation des données,http://projects.worldbank.org/en/projects-operations/procurement-detail/OP00341419,Burkina Faso,Strengthening Climate Resilience in Burkina Faso - P164078,Contract Award,French,"February 23, 2025",http://projects.worldbank.org/en/projects-operations/project-detail/P164078
Acquisition et livraison de vélo au profit de la DPEPS du Lorum dans le cadre du PAAQE (fonds de contingence).,http://projects.worldbank.org/en/projects-operations/procurement-detail/OP00341420,Burkina Faso,B. Faso - Education Access and Quality Improvement Project (EAQIP) - P148062,Contract Award,French,"February 23, 2025",http://projects.worldbank.org/en/projects-operations/project-detail/P148062
Rapid Pro System Officer,http://projects.worldbank.org/en/projects-operations/procurement-detail/OP00341421,"Egypt, Arab Republic of",Takaful and Karama Cash Transfer Expansion and Systems Building Project - P179665,Contract Award,English,"February 23, 2025",http://projects.worldbank.org/en/projects-operations/project-detail/P179665
"Acquisition et installation des équipements pour la mise en place de 6 salles réunion intelligentes, une par UCR",http://projects.worldbank.org/en/projects-operations/procurement-detail/OP00341422,Cameroon,Local Governance and Resilient Communities Project - P175846,Contract Award,French,"February 23, 2025",http://projects.worldbank.org/en/projects-operations/project-detail/P175846
FM consultant for PMT,http://projects.worldbank.org/en/projects-operations/procurement-detail/OP00341423,Iraq,Emergency Operation for Development - P155732,Contract Award,English,"February 23, 2025",http://projects.worldbank.org/en/projects-operations/project-detail/P155732
Project Officer,http://projects.worldbank.org/en/projects-operations/procurement-detail/OP00341424,Caribbean,OECS- Skills and Innovation Project - P179210,Contract Award,English,"February 23, 2025",http://projects.worldbank.org/en/projects-operations/project-detail/P179210
Acquisition de matériel et mobilier scolaire au profit de la DPEPPNF du Zondoma dans le cadre du Projet d’Amélioration de l’Accès et de la Qualité de l’Education (PAAQE) (Fonds de contingence),http://projects.worldbank.org/en/projects-operations/procurement-detail/OP00341425,Burkina Faso,B. Faso - Education Access and Quality Improvement Project (EAQIP) - P148062,Contract Award,French,"February 23, 2025",http://projects.worldbank.org/en/projects-operations/project-detail/P148062
Acquisition et livraison de vivres au profit de la DPEPS du Lorum dans le cadre du PAAQE (fonds de contingence).,http://projects.worldbank.org/en/projects-operations/procurement-detail/OP00341426,Burkina Faso,B. Faso - Education Access and Quality Improvement Project (EAQIP) - P148062,Contract Award,French,"February 23, 2025",http://projects.worldbank.org/en/projects-operations/project-detail/P148062
FMIS Network Officer,http://projects.worldbank.org/en/projects-operations/procurement-detail/OP00341427,Marshall Islands,Project to Strengthen budget execution and financial reporting systems - P163131,Contract Award,English,"February 23, 2025",http://projects.worldbank.org/en/projects-operations/project-detail/P163131
"Réalisation des ouvrages de drainage prioritaires (caniveaux, chaussées drainantes, collecteurs...) dans la ville de Niamey Zone 3",http://projects.worldbank.org/en/projects-operations/procurement-detail/OP00341428,Niger,Niger Integrated Urban Development and Multi-sectoral Resilience Project - P175857,Contract Award,English,"February 23, 2025",http://projects.worldbank.org/en/projects-operations/project-detail/P175857
"Développement,herbergement et gestion du site web",http://projects.worldbank.org/en/projects-operations/procurement-detail/OP00341431,Cameroon,Local Governance and Resilient Communities Project - P175846,Contract Award,French,"February 23, 2025",http://projects.worldbank.org/en/projects-operations/project-detail/P175846
Bisan Change Request,http://projects.worldbank.org/en/projects-operations/procurement-detail/OP00341432,Marshall Islands,Project to Strengthen budget execution and financial reporting systems - P163131,Contract Award,English,"February 23, 2025",http://projects.worldbank.org/en/projects-operations/project-detail/P163131
"Legislative Drafter for Procurement Code, Procurement Regulations and standard templates incl Draft cabinet Bill.",http://projects.worldbank.org/en/projects-operations/procurement-detail/OP00341433,Marshall Islands,Project to Strengthen budget execution and financial reporting systems - P163131,Contract Award,English,"February 23, 2025",http://projects.worldbank.org/en/projects-operations/project-detail/P163131
Experto Jurídico,http://projects.worldbank.org/en/projects-operations/procurement-detail/OP00341434,Colombia,Multipurpose Cadaster Project - P162594,Contract Award,Spanish; Castilian,"February 23, 2025",http://projects.worldbank.org/en/projects-operations/project-detail/P162594
Road Safety Works for Tongatapu and outer islands (4 Lots),http://projects.worldbank.org/en/projects-operations/procurement-detail/OP00341435,Tonga,Tonga Climate Resilient Transport Project II - P176208,Invitation for Bids,English,"February 23, 2025",http://projects.worldbank.org/en/projects-operations/project-detail/P176208
Especialista en Proyectos Catastrales y Cartográficos,http://projects.worldbank.org/en/projects-operations/procurement-detail/OP00341441,Colombia,Multipurpose Cadaster Project - P162594,Contract Award,Spanish; Castilian,"February 23, 2025",http://projects.worldbank.org/en/projects-operations/project-detail/P162594
"Réalisation des ouvrages de drainage prioritaires (caniveaux, chaussées drainantes, collecteurs...) dans la ville de Niamey Zone 1",http://projects.worldbank.org/en/projects-operations/procurement-detail/OP00341442,Niger,Niger Integrated Urban Development and Multi-sectoral Resilience Project - P175857,Contract Award,English,"February 23, 2025",http://projects.worldbank.org/en/projects-operations/project-detail/P175857
"Réalisation des ouvrages de drainage prioritaires (caniveaux, chaussées drainantes, collecteurs...) dans la ville de Niamey Zone 2",http://projects.worldbank.org/en/projects-operations/procurement-detail/OP00341443,Niger,Niger Integrated Urban Development and Multi-sectoral Resilience Project - P175857,Contract Award,English,"February 23, 2025",http://projects.worldbank.org/en/projects-operations/project-detail/P175857
